"Language teaching terms and ideas",
"Rhetorical terms",
"Alternative words for British",
"Greek words for love",
"Case-sensitive English words",
"Chicano Caló words and expressions",
"Dacian words",
"English words containing Q not followed by U",
"English words with disputed usage",
"Plain English words and phrases",
"French words of Arabic origin",
"Frequently misused English words",
"Replaced loan words in Turkish",
"Self-contradicting words in English",
"Longest English words with one syllable",
"Words derived from toponyms",
"Words having different meanings in British and American English",
"Words that may be spelled with a ligature",
"Words without vowel letters",
"Slang for police officers",
"Puerto Rican slang",
"South African slang",
"Wobbly lingo",
"American words not widely used in the United Kingdom",
"Australian English terms for food and drink",
"Australian English terms for people",
"British words not widely used in the United States",
"New Zealand English and Māori"
